{
 "R": 3,
 "date": "2026-09-25",
 "from_date": null,
 "kind": "fixture",
 "n": 0,
 "past": false,
 "rounds": [
  {
   "continues": true,
   "emoji": "📍",
   "i": 1,
   "multiple": 6.2,
   "seed_emoji": null,
   "title": "Test Answer Place One"
  },
  {
   "continues": true,
   "emoji": "🎬",
   "i": 2,
   "multiple": 2.4,
   "seed_emoji": null,
   "title": "Test Answer Film Two"
  },
  {
   "continues": false,
   "emoji": "🏅",
   "i": 3,
   "multiple": 3.8,
   "seed_emoji": "🎵",
   "title": "Test Answer Sport Three"
  }
 ],
 "seed": {
  "biggest_in_days": 1240,
  "emoji": "👤",
  "langs": 6,
  "multiple": 41.2,
  "since_records": false,
  "title": "Test Seed Article"
 },
 "status": "fixture"
}
